location,product,tender_number,tender_company,tender_name
"город Тханьшань, Нинде, провинция Фуцзянь",2-й тендер на проект строительства интегрированной системы профессиональной подготовки в здании JH в Нинде,202205120001-N1,"Самофинансирующееся предприятие, торгующее на участие в торгах на атомную электростанцию Fujinned Ltd.",2-й тендер на проект строительства комплексной системы подготовки кадров в здании JH в Нинде
Гуандун,Проект проекта AD LOT140Ca атомная нержавеющая стальная труба малого калибра (номер тендера: CGN-20230407003),CGN-20230407003,Чайна Хинон инжиниринг лимитед,
"Пекин, Тойота",Закупка Системой управленческой информации по проекту &quot; Интеллектуальная энергетика Китая &quot; ,CGN-20220909008,Чайна энтропия,
Чжэцзян,,CGN-20230303002,Чайна Инжиниринг лимитед,
"провинция Джилин, Белый город, Гранд-Ан","260 МВт ветряная установка ветроустановки в Джилинде, Новая энергетика в рамках проекта (номер тендера: CGN-202304240014)",CGN-202304240014,Energy White City Ltd.,
"округ Ваннань, провинция Чжэцзян",Закупка (перезакупка) лифта и установки лифта для проекта Jiangang BJ по проекту (закупка тендера) (номер тендера: CGN-202303160016-N1),CGN-202303160016-N1,Чайнаннан,
Гуандун,Проект LOT45K Быстрая загрузка проекта LF (номер тендера: CGN-20230223003),CGN-20230223003,,
"Хэбэй, Чжан Сяо, округ Чжан","Ветряная станция Чайна Дружба Севера , Чайна , Чаддкрат , Чакрат",No CGN-20230608003,< &lt; Хэнчэн &gt; &gt;,
"провинция Шаньси, Дамаск, округ",Объявление конкурса PC по трем ветроэнергетическим проектам,,,
Гуанси,Проект BT LOT111B для фильтрации контейнеров для фильтров и перегрузки контейнеров с отходами (номер тендера: CGN-CGN),20221108002,Чайна инжиниринг лимитед,
Шэньчжэнь,Закупка кабелей для цифровой переработки (LOT2),CGN-202207190012,атомный комплекс Гуандун,
Гуандун,Оборудование связи на предприятии по проекту морской ветроэнергетики в порту Кюсю,CGN-202212130003,Чайна Инжиниринг лимитед,
"Немонгольский автономный округ, город Ордос, Хан Цзинь",проект экологического восстановления в рамках проекта Шанхайского храма Хан Цзинь Флаг 200 МВт фотоволжского проекта «Линфу плюс»,CGN-20221110002,,
провинция Шаньдун,Проект проекта SK LOT140Ca атомная нержавеющая стальная труба малой калибровки (номер тендера: CGN-202303160014),CGN-202303160014,Чайна инжиниринг лтд.,
"префектура Юньнань, чусуньский автономный округ, префектура Осаки",оборудование для компенсации за неустойчивость в 2022 году,CGN-20221208001,Чусун,
Гуандун,Проект PY01 с комплектом проектного оборудования для освещения LOT82,CGN-202211110002,,
Гуандун,,CGN-20230213003,,Проект AD LOT110
Гуандун,,CGN-202211010004,Гуанчжоу энтерпрайз лимитед,
,,,,
Ляонин; Далянь; Вау,Закупка интеллектуального крейсера для CRF-компаний по проекту «Красная река» (CGN-202303160013),CGN-202303160013,Ляонин,
провинция Шаньдун,Проект SK LOT130Fa CFI фильтры и терминалы ECS фильтры,CGN-202306007,,
"Синьцзян-Уйгурский автономный округ, Баян-Монгольский автономный округ, Жуан",основное оборудование для проекта «Синьцзян» (проект ветроэнергетики),CGN-20230704002,Новая энергетическая компания,
"провинция Шаньси, муниципалитет Лу Лян, каменный округ",100 МВт агрономического фотоэлектрического комплекса,CGN-20220615001-N1,Ветряная энергетика,
"провинция Гуйчжоу, муниципалитет Анхен, округ Хунглингбуйи",,CGN-20230710002,,
"атомная электростанция Нинде, муниципалитет Фукуяма, провинция Фуцзянь",проект модернизации строительного крышка на заводе 2023 года в Нинде,CGN-20230425007,Fujinnder,объявление тендера на проект модернизации строительного крышка на заводе 2023 года в Нинде
Цзяннань,"Проект CS проекта 3, 4, LOT130Aa, первая партия сборных контейнеров для ядерного острова",CGN-20230213005,Чайна Инжиниринг лимитед,
Гуандун,Проект LOT101DD (перезагрузка),CGN-20220926006-N1,Чайна Хинонжиниринг лимитед,
,,,,
"Хэйлунцзян, муниципалитет Хэйэя, 5 крупных городов",Проект строительства 220-километровой ветряной станции в рамках проекта &lt; &lt; Мир 200 МВт &gt; &gt; (заказ No CGN-V),CGN-20230506002,,
"префектура Аньхой, муниципалитет Тяньаньмэнь",100 МВт ветроэнергетический проект PC (заказ No CGN-20230529003),CGN-20230529003,,
"Пекин, Тойота",Сбор фотоэлектрических компонентов,CGN-202307040011,"Самофинансируемый и выполненный, а торгующее лицо имеет ограниченную мощность ветряного ветра компания.",
"провинция Цинхай, тибетский автономный район Хайси-Монголия, муниципалитет Деринха",Строительство фотоэлектрической зоны в рамках проекта &lt; &lt; Интегрированная система хранения фотоэлектрической энергии &gt; &gt; (пункт 1),CGN 20221107001,Новая энергетическая компания,
Порт-оф-Си,"Проект Порт-оф-Спейн , проект Мониторинг окружающей среды на суше , 2023 - 2027 годы",CGN-20221124001,Чайна инжиниринг лимитед,
"провинция Цинхай, тибетский автономный район Хайси-Монголия, муниципалитет Деринха","500 МВт ветроэнергетического проекта 500 МВт в новом энергетическом озере Цинхайо в рамках этого проекта, платформа для подвески, проект базовой инженерной установки ветроэнергетики (запрос)",CGN-20230316009,Чайна-Хеллоу,
"провинция Хэйлунцзянган, Цзиньцзян, округ Цинго",Закупка шкафов для высоковольтного переключателя в рамках проекта &lt; &lt; Хэйлунцзянган &gt; &gt; и &lt; &lt; Большой восьмерки &gt; &gt; (запрос No: CGN-CGN),,Гранд-Лэндз лимитед,Объявление предложений
"Синьцзян-Уйгурский автономный округ, Та-Сити, округ Торри",Проект башня 75 000 кВт/ч с 300 000 кВт-часовой резервной мощностью в 300 000 кВт-часовой электрической установкой,CGN-20221020007-N1,TORY,
Гуандун,Проект Интегрированная стадия предварительного строительства и установки ветряных машин в порту Гуанчжоу-2 (сбор предложений по проекту),CGN-20221019007,Самофинансирующееся предприятие,
Гуандун,Устройство измерения температуры неядерного класса LOT101F для группы 5 и 6 проекта &quot;Земля&quot; (номер тендера: CGN-202304120005),CGN-202304120005,Чайна Хинон инжиниринг лимитед,
Автономный район Гуанси-Шань,Устройство для очистки сфер LOT52Bc в блоке 1 и 2 проекта &lt; &lt; Порт-оф-Спейн &gt; &gt;,CGN-202211180003,Чайна инжиниринг лтд.,
Пекин,Закупка шкафов безопасности системы управления системой DCS и внутренней обработки приложений на АЭС (пункт 1),CGN-20230410008,China Nuclear Systems Engineering Ltd.,
Гуанси-Шань,Проект BT LOT42Ab Конденсационные насосы и насосы с низкой инфляцией (перезакупка),CGN-202210130001-N1,Чайна Инжиниринг лимитед,
"Юньнань, автономный округ Чусун, округ",проект 90 МВт в Новой деревне (запрос No CGN-CGN),20221205001,Ветроэнергетика лтд.,
провинция Шаньдун,Проект по обслуживанию вибрации вибраций (заявочный номер: CGN-20230119006),CGN-202301190006,Чайна Хинон инжиниринг лтд.,Объявление предложений по проекту CW
Порт-о-Пренсе,Проект по проектированию и планированию рамочного соглашения по проектированию и проектированию ядерно-энергетических комплексов в Порт-о-Пренсе,202305110004,Atomic Energy Ltd.,
"префектура Аньхой, муниципалитет Тяньаньмэнь",Закупка оборудования для ветрогенератора ветроэнергетического поля Лю Цзяоцзяо,CGN-20221008002,,
"провинция Хэйлунцзян, Цзиньцзян, округ Цинго",Проект по закупке электрической линии в рамках проекта 200 МВт новых источников энергии + емкости энергии в районе Хэйлунцзянган (показатель 2) (торги),CGN-202305160010,China New Energy Co. Ltd.,
"провинция Юньнань, город Юйцзи, округ Яньцзян-хани",,CGN-20230706003,Юйцзян энтеррейд,
"префектура Сычуань, муниципалитет Чжоучжоу, префектура Гуань",совместная закупка основного оборудования,CGN-20230426003,Гуанчжоу,
"префектура Юньнань, чусуньский автономный округ, префектура Осаки",Проект 100 МВт наземной ветровой электроэнергии 2-й этап проекта (запрос No CGN-20230201001),CGN-202302010001,Чусун Ltd.,
провинция Шаньдун,Проект SK LOT150Ai (Йодный ингалятор системы HVAC),CGN-20230518005,Чайна энжиниринг лимитед,
,,,,
"Янцзы, провинция Гуандун","Проект по совершенствованию противопожарной безопасности передвижных насосов, таких как Y2, Y3 и Y6 и APA",CGN-202212020004,,
"Пекин, Тойота",Закупка шкафов для высоковольтного переключателя в 2023 году,CGN-202304060014,"Самофинансируемый и реализованный, а торгующее лицо имеет ограниченную атомную энергию компания",
"провинция Цинхай, тибетский автономный район Хайси-Монголия, муниципалитет Деринха","500 МВт ветроэнергетического проекта 500 МВт в новом энергетическом озере Цинхайо в рамках проекта, платформа для подвески, 2-й этап инженерного строительства ветроэнергетики (торги)",CGN-20230316008,Чайна-Хеллоу,
Пекин,Закупка панели и операционной стойки для имитатора группы,,,
"Синьцзян-Уйгурский автономный округ, Баян-Монгольский автономный округ, Жуан",Закупка оборудования GIS на открытом воздухе в рамках проекта «Синьцзян-2023» (второй пункт: фотоэлектрический проект),CGN-202307040024,,
провинция Шаньдун,CW проектные проводы для дренажных труб через железнодорожный проект,CGN-20230425001,Чайна Хинон инжиниринг лтд.,
Гуандун; Фуцзянь,Проект AD и проект BZ LOT140Cj (Устройство крупного калибра нержавеющей стали на атомном уровне) (номер тендера: CGN-20230228002),CGN-20230228002,Чайна Хинонжиниринг лимитед,
"Шанхай, Шанхай, Зон Мин",30 МВт проект по производству фотоэлектрической энергии EPC,CGN-20220720002-N3,Шанхайская компания Белая энергетика,Объявление тендера на строительство 30 МВт проекта по производству фотоэлектрической энергии EPC (четвертый прием)
,,,,
"Ханан, Южный Ян, муниципалитет Данчжоу",Закупка оборудования для ветряных генераторов мощностью 100 МВт (включая башни) в летний период в рамках этого проекта (заказ No CGN-CGN),CGN-CGN,Дун Стейт Компани,
Цзянвин,,,Чайна Хинси,
"Пекин, Тойота",Закупка матрицы комплексной автоматизированной системы электроснабжения 2023 года (третий пункт),CGN-202304060019,,
Гуандун,Оборудование системы мониторинга радиационной среды на АЭС Тайпин,CGN-202306020008,Чайна Хинэ,
Гуандун,Экспериментальное техническое обслуживание и коммуникационное оборудование в рамках проекта &lt; &lt; Порт-2 &gt; &gt; в Гуанчжоу (первый этап) (сбор предложений по проекту),CGN-202302220010,Ltd.,
Пекин,Закупка незащищенных шкафов для маломасштабной проектной системы DCS на атомной электростанции,CGN-20230410007,,
"Синьцзян-Уйгурский автономный район и Тэгу, округ Лоуп","Закупка ретрансформатора проекта &lt; &lt; Лоуп 1 млн кВт &gt; &gt; на базе экологически чистой энергетики в рамках проекта (2 тендера) (No: CGN-202307050010 был утвержден утверждающим подразделением, финансируемым из частных источников и реализованным, торгующим на участие в торгах на атомное солнце Тумушук. В рамках этого проекта уже имеются условия для проведения торгов и в настоящее время проводятся открытые торги.",,,
Гуандун,Закупка услуг по геодезической съемке и оценке опасности геологических катастроф,CGN-20221221001,China Institute of Nuclear,Объявление предложений о закупке услуг по геодезической съемке и оценке опасности геологических катастроф
"Шэньчжэнь, провинция Гуандун",Проект матрицы поддержки разработки программного обеспечения компании IQ,CGN-202303030003,компания с ограниченной ответственностью,
"провинция Цинхай, Тибетский автономный район Хайси-Монголия, город Герму",кабель в районе Цинхай,CGN-202303140015,Ветроэнергетическая компания,
"провинция Хэйлунцзян, Цзиньцзян, округ Цинго",Проект по закупке электрической линии в рамках проекта 200 МВт новых источников энергии + емкости энергии в районе Хэйлунцзянган (показатель 1),CGN-20230516008,China New Energy Co. Ltd.,
"Шэньчжэнь, провинция Гуандун",Проект по модернизации оборудования для жилых помещений в 2023 году на электростанции в Большом заливе,CGN-202307050024,компания с ограниченной ответственностью,
"Пекин, Тойота",5-й пункт 5 второго контрольного набора новых энергетических ресурсов 2023 года,CGN-202305240006,Энергетическая компания Dun State Company,Объявление тендера на 5-й участок 5-го секвенирования проекта 2023 года
"провинция Цинхай, тибетский автономный район Хайси-Монголия, муниципалитет Деринха",азотная кислота,CGN-202303010008-N2,Хендэ,
"Пекин, Тойота",,,,
,,,,
"префектура Сычуань, муниципалитет Гуаньюань, округ Шин",Четвертое совместное приобретение кабелей в 2023 году (третий пункт: региональный кабель Сычуань),CGN-202305310004,Ветроэнергетическая компания,
провинция Шаньдун,Проект SK LOT130Ra фильтрации для замены оборудования для перевалки (номер тендера: CGN-20230606006),CGN-20230606006,Чайна инжиниринг лтд.,
Гуанси,Проектный блок LOT160Ca ARE для клапанов охлаждения (запрос No: CGN-C),,,
"Синьцзян-Уйгурский автономный район и Тэгу, округ Лоуп",Закупка 1 млн кВт фотоэлектрических компонентов проекта на базе экологически чистой энергетики в рамках проекта (2 тендера) (номер тендера: CGN-,CGN-,Мушук лимитед,
"провинция Ганьсу, город фонтан, Дюнъюнь",Проект строительства фотоэлектрической сети Гуандун 20 МВт,No CGN-20230705006,Электроэнергия,
"Гуандун, Фуцзянь",Проект AD и проект BZ LOT42Ab (Космические насосы и насосы с низкой инфляцией),CGN-20230508002,Чайна Хинонжиниринг лимитед,
"Вэньчжоу, Чжэцзян",Проект CS Сервис по мониторингу водной среды в рамках проекта CS,CGN-20230425005,Чайна Хинси,
Гуандун,,CGN-20230109001,Чайна Хинси,
провинция Шаньдун,,CGN-20230314006,Чайна инжиниринг лтд.,
Гуандун,Проект Наземный проект 5 и 6 LOT19B Система командования ядерными чрезвычайными ситуациями,CGN-202304270012-N1,Чайна инжиниринг лтд.,
"провинция Цинхай, тибетский автономный район Хайси-Монголия, муниципалитет Деринха",500 МВт наземной ветроэнергетики на базе Голубого моря-Холодного озера,CGN-202303200011,,
"Синьцзян-Уйгурский автономный округ, Алтайский район, Гимуна",,CGN-20230425003,широкий спектр джимонов в Синьцзяне,
,,,,
Хубэй,Проект распределенной фотоэлектрической оптики EPC в рамках проекта Hong Kong China Hong Kong,CGN-20221020003,Хэбэй лимитед,
Гуандун,"Оборудование GIS и дизельные генераторы в морской ветровой электростанции Чжоу , порт 2PA, проект финансируется за счет самофинансирования",CGN-20220929003,,
префектура Гуйтинг,третий пункт для контроля и оценки первого проекта 2023 года по новой энергетике Китая и Китая (номер тендера: CGN-),CGN-20230306005,Ветроэнергетическая компания,
"провинция Гуйчжоу, 6 водохозяйственных городов, 6 специальных районов",70 МВт проект по проектированию наземной ветроэнергетики в шести областных зонах Гуанчжоу (запрос No: CGN-CGN),20230223002,Ветроэнергетическая компания,
"Синьцзян-Уйгурский автономный округ, Та-Сити, Тауэр",Замены коробок (пункт 2: Ветряный ящик в Синьцзян-Тауне),CGN-20221117004,Новая энергетическая компания,
"Гуандун, Чжэцзян","Проект AD, CS LOT4 Закупка аэродинамических блоков",CGN-20230629002,,
"провинция Джилин, Белый город, Гранд-Ан",проект по комплексному энергоснабжению на основе твердого течения Джилинда Анджесилу (перезакупка),CGN-202209130004-N1,Даань,
"Синьцзян-Уйгурский автономный округ, Алтайский район, Гимуна",Закупка оборудования для связи с джимомией в Синьцзяне в рамках проекта (запрос No CGN-20221010003) была одобрена секцией,,Синьцзян,
провинция Шаньдун,,CGN-20230330001,Чайна Инжиниринг лимитед,
"Тибетский автономный район, район Али, округ Тир",Экспериментальный проект по фотоэлектрическому накоплению «нулевого углерода» на снежном плато Ali 150 МВт в Тибете (50 МВт фототермальной части),CGN-202301160008-N1,Али,
"Синьцзян-Уйгурский автономный округ, Та-Сити, Тауэр",Проект по закупке линий электропередачи в Синьцзян-Тауне (заказ No CGN-20230606003),CGN-20230606003,Чайна нью-Энтерпрайз,
"провинция Цинхай, тибетский автономный район Хайси-Монголия, муниципалитет Деринха",Интегрированная система хранения тепловой энергии,CGN-20221226003,Дилингха лтд.,
