location,product,tender_number,tender_name,tender_company
"провинция Джилин, Белый город, Гранд-Ан",Закупка 1-го башня в рамках проекта &lt; &lt; Интегрированная энергетика &gt; &gt; мощностью 490 МВт,CGN-202301060003,,
"Гуандун, Чжэцзян",насосы для важнейших заводов,CGN-202306150009,Проект AD проекта и проект CS LOT134C - насосы для важнейших заводов,Чайна Хинси
"Синьцзян-Уйгурский автономный район и Тэгу, округ Лоуп",1 миллиона киловатт фотоэлектрических установок на базе экологически чистых источников энергии,CGN-CGN,Закупка 1 миллиона киловатт фотоэлектрических установок на базе экологически чистых источников энергии в рамках проекта (1 тендер) (No CGN-CGN),Мушук лимитед
"Шэньчжэнь, провинция Гуандун",генератора электрического тока,CGN-20230529002,,China Institute of Nuclear
АЭС,Расширение резины,LFLOT140GaNICGN 202306080013,Проект LOT140Ga Расширение резины на АЭС,Чайна инжиниринг лтд.
"Янцзы, провинция Гуандун",разработка проекта по автоматическому переключению нового топливного тары Янцзы в рамках проекта,CGN-20230531005,,Jiangian
Гуандун,гидравлические блоки для основного оборудования на АЭС,CGN-20230328002-N1,,Чайна Инжиниринг лимитед
"Шэньчжэнь, провинция Гуандун",кабеля для измерения проекта,CGN-202304030007-N2,,
,,,,
"Вэньчжоу, Чжэцзян",проект CS,CGN-2022127001,Объявление тендера на проект CS,Чайна Хинси
Чжэцзян,специализированные кольца и подвески,CGN-20221110001,Проект BJ LOT11M,Чайна Хинси
"Гуандун, Уичжоу, Уидон",2PB 300 МВт морской ветроэнергетический комплекс,CGN-20221115007,Уведомление о торгах на контроль за морскими ветряными фермами в порту Хиросимы,Чайна Хинэ
провинция Шаньдун,ручной плавучий клапан и корректирующий клапан &lt; &lt; тройка &gt; &gt; ,CGN-20230419004-N2,Проект проекта SK LOT190Bh ручной плавучий клапан и корректирующий клапан &lt; &lt; тройка &gt; &gt; (номер тендера: CGN-20230419004-N2),Чайна Хинон инжиниринг лтд.
провинция Цзянсу; муниципалитет Су; округ Гусу,экспериментальное оборудование для модификации проекта,CGN-202212070003,,
Гуандун,замкнутая система видеонаблюдения,CGN-202304240011,,Чайна инжиниринг лтд.
"Хэбэй, Хан-де-ду-Сипин",100 МВт агроэкономического проекта EPC,CGN-20230616001,,Компания с ограниченной ответственностью.
"провинция Хэйлунцзян, Цзиньцзян, округ Цинго",наружное высоковольтное оборудование,CGN-20230529005,,Новая энергетическая компания
"Вэньчжоу, Чжэцзян",Услуги по мониторингу морской среды в рамках проекта CS,CGN-20230619001,Объявление предложений по проекту услуг по мониторингу морской среды в рамках проекта CS (Контингент: CGN-20230619001),Чайна Хинон инжиниринг лтд.
"Пекин, Тойота",сбор оптических кабелей для новых источников энергии,CGN-2024,,Чайна Хинэ
BZ: AD: Гуандун,оборудования для тары под давлением и нагревателей для производства горячей воды в рамках проекта BZ и проекта AD LOT41Ca и проекта BOP (серия тендерных заявок),CGN-20230629001,,China Institute of Nuclear
"префектура Юньнань, чусуньский автономный округ, префектура Осаки","дороги, подвесные платформы, ветряные машины и коробки",CGN-2022127003,"Объявления о тендере на строительство дорог, подвесных платформ, ветряных машин и коробок в рамках проекта &lt; &lt; Тунда-2 &gt; &gt;",Чжуцунь
Гуандун,Проект LOT111M (специализированные кольца и повешение),CGN-20230516002,Проект LOT111M (специализированные кольца и повешение) проекта LF (Конференция No CGN-20230516002),Хинонжиниринг лимитед
Чжэцзян,Проект CS по проекту LOT140Pc,CGN-202211160008,,Чайна Хинонжиниринг лимитед
Гуандун,Эксплуатационные блоки для генераторов,CGN-20221017005,Проект LOT62 (Конференция No CGN-20221017005),Чайна Хинон инжиниринг лимитед
"округ Ваннань, провинция Чжэцзян",утилизация использованных материалов в рамках проекта &quot; Чжэцзян &quot; ,CGN-20221129002,Объявление торгов на утилизацию использованных материалов в рамках проекта &quot; Чжэцзян &quot; ,Чайна Хинси
"Шэньчжэнь, провинция Гуандун",кабельного оборудования для измерения проекта,CGN-202304030007,,
"Синьцзян-Уйгурский автономный округ, Та-Сити, округ Минь",мониторинг вибраций на ветряной электростанции &lt; &lt; майитас &gt; &gt; ,CGN-20230607001,"Глава I. Объявление предложений Район, в котором осуществляется тендерный проект: Синьцзян-Уйгурский автономный округ, Та-Сити, округ Минь Условия торгов",Ветроэнергетическая компания. В рамках этого проекта уже имеются условия для проведения торгов и в настоящее время проводятся открытые торги.
провинция Шаньдун,электрический нагреватель системы HVAC на Ядерном острове,CGN-202306140009,,Чайна Инжиниринг лимитед
провинция Шаньдун,Проект SK LOT134Ic (TEP и TEU паровые компрессоры),CGN-202302020001,,Чайна Хинэ
"Янцзы, провинция Гуандун",Проект оптимизации CRF-циркулирования корневых валовых насосов (перезапрос) проекта,CGN-202305040001-N1,,
"Гуандун, Чжэцзян",охлаждающие насосы для оборудования AD в Гуандуне,CGN-20230420005,,Чайна Инжиниринг лтд.
"Янцзы, провинция Гуандун",Проект оптимизированных закупок CRF-циркуляторного насоса CRF,CGN-20230504001,Уведомление о торгах,Jiangian
"Территория, в которой находится проект торга:",2-й строительный дорожный зал и предложения,CGN-202303210002,,Чайна Хинон инжиниринг лтд.
"Синьцзян-Уйгурский автономный округ, Баян-Монгольский автономный округ, Жуан","основное оборудование для проекта ""Синьцзян"" (третий пункт: фотоэлектрический проект)",CGN-20230704004,Объявление предложений,Чайна Хинэ
провинция Шаньдун,Проект SK LOT5 (перезагрузка),CGN-20230518002-N1,,Чайна Инжиниринг лимитед
"префектура Сычуань, муниципалитет Чжоучжоу, префектура Гуань","50 МВт ветряная дорожка, платформа, база ветряных двигателей и базовая инженерная работа по переработке коробок (запрос)",CGN-202304240020,,Чайна тайфун
Гуандун,Проект LOT101 De из нержавеющей стали PIPE (перезакупка),CGN-20221018001-N1,,Чайна Инжиниринг лимитед
провинция Шаньдун,метрический насос и электроизоляторный насос,CGN-202304190005-N1,SK проект LOT134Hc метрический насос и электроизоляторный насос,Чайна Хинси
"Синьцзян-Уйгурский автономный округ, Та-Сити, округ Торри",300 000 кВт-часовая установка электрического подвешивания,CGN-202212080010,,TORY
"Тибетский автономный район, район Али, округ Тир",Экспериментальный проект «Нулевой углерод» для хранения тепловой энергии в снежном равнине Alien на 20 МВт для генерального подряда на проект EPC,CGN-20230117005,,
Гуандун,Проект AD LOT134Ic (TEP паровой компрессор),CGN-202306070009-N1,,Чайна Инжиниринг лимитед
провинция Гуандун,дизельные генераторы для экстренного использования в проекте HLF,CGN-202307040028,Проект по закупке дизельных генераторов для экстренного использования в проекте HLF (номер тендера: CGN-202307040028),Чайна Хинон инжиниринг лтд.
"провинция Юньнань, город Юйцзи, округ Яньцзян-хани",новые энергетические кухонные плиты,CGN-20230505001,220-километровый проект по выпуску новых энергетических кухонных плит (220 кВ - N58),Юйцзян энтеррейд
провинция Фуцзянь,Проект BZ LOT134Ib (компрессоры TEG),CGN-202305230002-N1,,Чайна Инжиниринг лимитед
"провинция Джилин, Белый город, Гранд-Ан",490 МВт - 1-я закупка фотовольтных постов в рамках проекта &lt; &lt; Интегрированная энергетика &gt; &gt; ,CGN-20230105003,,Energy White City Ltd.
"Янцзы, провинция Гуандун",Закупка 2-го тендера на сканирование электронно-оптических микроскопов на объекте проекта,CGN-202303150009-N1,,Чайна энтерпрайз
провинция Шаньдун,Устройства измерения трафика и ограничения потока на ядерных островах,CGN-202305310007,"Проект SK 1, блок 2 LOT140L",Чайна Хинэ
"Чжэцзян, город Нимбо, северный округ",Проекты в области энергетики,CGN-20230116001,Объявление предложений по генеральному подряду на проекты в области энергетики,"Нинбо, Восток"
Гуандун,Термический трафик,CGN-202303010003,"Сухой проект 5, 6-й блок LOT101V Термический трафик",
Гуандун,"Проект AD-проект 3, блок 4 LOT130Ab Вторая партия тары для захоронений (No тендера: CGN-20230317004))",CGN-20230317004,,Чайна Инжиниринг лимитед
"Янцзы, провинция Гуандун",Устройства и ножи в комплексном производственном центре в рамках проекта,CGN-20221130005,,Чайна энтерпрайз
"Автономный район Гуанси-Шань, муниципалитет Чинбэя",фотоэлектрическая энергия,CGN-20230406001,"Объявление конкурса на проведение генерального подряда на проект PC по производству фотоэлектрической энергии в Гилоне, Северный Чин",Чайна Хинэ
"Хэбэй, Чжунцзяо, Цзиньцзян",Генеральный контракт EPC (по 2-этому озеру),CGN-20230608004,"Китайская компания China &apos; s Northern &apos; s friends, Lake of the Language, Mitsubishi City Television разместила генеральный контракт EPC (по 2-этому озеру)",Чжоу
"База в заливе Гранд-Авто, Шэньчжэнь",техническая поддержка для модернизации старых лифтов на АЭС &lt; &lt; Лингвэй &gt; &gt; ,CGN-20221018002,Объявление тендера на закупку технической поддержки для модернизации старых лифтов на АЭС &lt; &lt; Лингвэй &gt; &gt; ,Чайна Хинэ
"Гуандун, Шэньчжэнь",Экспериментальный образец для вибрации топливного компонента проекта X11,CGN-20230518007,Закупка экспериментального образца для вибрации топливного компонента проекта X11 (Конференция No CGN-20230518007),Чайна Хинэ
"город Нинде, Фуцзянь",Проект строительства и обслуживания подсистемы управления измерениями в рамках проекта BZ,CGN-202211240005,,
"провинция Джилин, Белый город, Гранд-Ан",электрическая линия,CGN-20230228005,Закупка электрической линии в рамках проекта &lt; &lt; Интегрированная энергетика &gt; &gt; мощностью 490 МВт,Energy White City Ltd.
"провинция Ляонин, город Ханьян, округ Ханьян",комбинированное производство электроэнергии,CGN-202212020008,,
провинция Фуцзянь,RCV Регулирование системы,BZLOT190B,BZ проект LOT190Bi RCV Регулирование системы,Чайна Хинэ
провинция Шаньдун,поставка,CGN-20230328007,Гран-при на поставку,Чайна Инжиниринг лимитед
"префектура Гуйчжоу, автономный округ Минамбуйи, префектура Гуйтинг",оборудование для ветрогенераторов,CGN-20230106005,,Quote Power Company
,,,,
"Пекин, Тойота",шкафы для высоковольтных переключателей с высоким давлением,CGN-202304060015,,Чайна Хинси
Гуандун,Проект LOT140L по проекту LOT140L (перезакупка),CGN-202209280001-N1,,
провинция Шаньдун,Устройство фильтрации системы HVAC,CGN-20230314001,Проект SK LOT150Ae,Чайна инжиниринг лтд.
"Шэньчжэнь, провинция Гуандун",Проектная платформа для моделирования окружающей среды подводной лазерной стыковки на атомных электростанциях и закупка запасных частей,CGN-20221130003,,
провинция Шаньдун,ТЭГ-компрессор,CGN-202307110012,Проект CW LOT134Ib (ТЭГ-компрессор),Чайна Инжиниринг лимитед
"провинция Цинхай, Тибетский автономный район Хайси-Монголия, город Герму",оборудование для компенсации за неустойчивость на озере Цинхайхен,CGN-202303140010,,Чайна Хиросима
"Янцзы, провинция Гуандун",механические ручки для линейных корпусов,CGN-202301030002-N1,,China Institute of Nuclear
Автономный район Гуанси-Шань,"Проект BT LOT190Fb бабочки, клапаны морских бабочек, клапаны отверстий и крышка канала отверстий",CGN-20221016001,,
провинция Фуцзянь,Безопасные клапаны,CGN-202304270002-N1,Проект BZ LOT190Aa (Безопасные клапаны),China Nuclear Power Engineering Company Limited
"провинция Чжэцзян, муниципалитет Каньшань, округ Чжуншань",оборудования для морской ветроэнергетики (переоборудование) (управление),CGN-202303210001,,Ветроэнергетика
Фуцзянь,Проект по ремонту нетехнического строительного оборудования за пределами UD 2023 - 2024 гг.,CGN-202301120002,Объявление тендера на проект по ремонту нетехнических производственных помещений за пределами UD на 2023-2024 годы,Чайна Хинэ
Шэньчжэнь,"Проект по закупке материалов для предварительной замены трубы из углеродной стали &lt; &lt; СЕН &gt; &gt; , блок 1/2 АЭС &lt; &lt; Большой Азиатский залив &gt; &gt; (заявка No: CGN-CGN)",CGN-20230228001,,Чайна Хинэ
"Хунань, Юнчжоу, округ Нойда","100 МВт/200 МВт в рамках проекта &lt; &lt; Контейнерный контракт &gt; &gt; на проект &lt; &lt; Сплошной запас &gt; &gt; , проект &lt; &lt; ЕПК &gt; &gt; , проект &lt; &lt; Синьхуа &gt; &gt; , проект &lt; &lt; Синьхуа &gt; &gt; ",CGN-20221008001,,Новая энергетика
"провинция Гуандун, муниципалитет Ташань",оборудование для замены ретрансляторов с нулевым циклом для защиты от торможения на обычных островах в рамках проекта,CGN-CGN,,
Гуандун,Проект проекта SK LOT190S LOT190S,CGN-20230403004,,Чайна Хинон инжиниринг лимитед
Нижняя Монголия,вторая система камер УНИТА (пункт 2: &lt; &lt; Запуск &gt; &gt; станции &lt; &lt; Ф &gt; &gt; и &lt; &lt; Г &gt; &gt; )),CGN-20230224003,,
Чжэцзян,Производственная установка,CGN-20230223007,Проект CS LOT140Pb Производственная установка,Чайна Инжиниринг лимитед
Гуандун,Сухопутные клапаны,CGN-202306130006,"Проект LOT45B &lt; &lt; Сухопутные клапаны &gt; &gt; , проект 5 и проект 6",Чайна инжиниринг лтд.
Гуандун,Электромагнитные клапаны,CGN-20230630004-N1,,
провинция Шаньдун,Ядерный архипелаг,CGN-20230619004,SK LOT101Db,Хинонжиниринг лимитед
Шанхай,оборудование для передачи в рамках проекта Шанхайского проекта Ускоритель и пакеты для передачи,CGN-20230427001,,Чжунъюнк
"Юньнань, муниципалитет Цюй, Цзюй",,CGN-202212080005-N1,,
провинция Шаньдун,противопожарное оборудование завода,CGN-202306080012,Проект проекта SK LOT49A по противопожарному оборудованию завода,Чайна Хинси
"Ханан, Открытый город, Ланко",200 МВт наземный ветроэнергетический проект по озеленению воды и восстановлению окружающей среды,CGN-202304240010,,
"Гуандун, муниципалитет Уитон",Проект 2PA и PB морской ветровой электростанции в порту Гуаняо (No тендера: CGN-202304250006)),CGN-202304250006,Объявление конкурса (Контингент: CGN-202304250006),China Nuclear Engineering & Construction Corporation
"префектура Аньхой, муниципалитет Тяньаньмэнь",первый слияние кабелей (первый пункт: региональный кабель Аньхой),CGN-20230105007,,
"Гуандун, Чжэцзян и Фуцзянь",Оборудование для нагрева воды,CGN-202306140007,,Чайна инжиниринг лтд.
провинция Цзянсу; муниципалитет Су; муниципалитет города,Модернизация системы мониторинга на базе трансляторов GB на трех электростанциях в рамках проекта,CGN-20230216003,Уведомление о торгах,Гуандун энтерпрайз / Ling Atomic Energy Ltd.
"Вэньчжоу, Чжэцзян",Проект создания и технического обслуживания подсистемы управления измерениями проекта CS (перезакупка),CGN-202302160002-N1,,
провинция Шаньдун,Проект 1-2 проекта SK LOT120Na (RPV Metal теплица),CGN-20230210001,,
Гуандун,"ЦК Гуаньчжоу, 2-й морской ветротехника и установка ветряных установок",CGN-20221108004,Проект Интегрированная стадия предварительного строительства и установки ветряных установок II в порту Хиросимы (сбор предложений по проекту),Чайна Хинэ
проект AD: Гуандун,атомный бесшовный трубопровод с углеродной стали (перезакупка),CGN-CGN,,
Гуандун,Проект LOT88Aa,CGN-20221116005,,Чайна Инжиниринг лимитед
,,,,
Пекин,шкафы небезопасного класса для системы управления DCS на АЭС проекта (разъем 03_ Атомная система управления DCS),CGN-202304100004,Уведомление о торгах,Хинли инжиниринг инжиниринг
"Шэньчжэнь, провинция Гуандун",Техническое обслуживание малокалиберной системы АСОТД в рамках проекта,CGN-202304230002,Закупка технических средств для технического обслуживания малокалиберной системы АСОТД в рамках проекта,Чайна энтерпрайз
Гуандун,"Наземный проект 5, блок 6 500 кВ ГИС",CGN-20230227001,,Гуанчжоу энжиниринг лимитед
Гуандун,"Реконструкция системы VVP и GCT &lt; &lt; Красная цепь &gt; &gt; , проект 5, проект &lt; &lt; Красная река &gt; &gt; , проект &lt; &lt; Реконструкция &gt; &gt; ",CGN-202212120003,,Чайна Хинон инжиниринг лтд.
