location,product,tender_number,tender_company,tender_name
"Чжэцзян, Кэррсинг, Хайян",30 МВт фотоэлектрического проекта EPC по производству электроэнергии на соляном терминале в Китае,CGN-20221010006,Чайна Хинси,Генеральный контракт на проект EPC по производству фотоэлектрической энергии мощностью 30 МВт в рамках проекта Гидроморфный терминал (запрос No: CGN-CGN)
Пекин,Проект по закупке услуг по оценке участия компании Энергоноэнергетика,CGN-202207250005-N2,,
"Шэньчжэнь, провинция Гуандун","Проект матрицы поддержки разработки программного обеспечения компании IQ (показатель 02 - Интеллектуальный синергетический бизнес) (номер тендера: CGN-202303030004, одобренный, финансируемый за счет собственных средств и реализованный, торгуемый за научно-информационную технологию",CGN-202303030004,компания с ограниченной ответственностью,
провинция Шаньдун,1000 кВ на проектном заводе CW,CGN-20221129004,Шэньчжэнь Чжэнь,
"Ханан, Цзиньян, префектура Инцзян",100 МВт наземной ветровой электростанции 110 КВ в рамках проекта (перезакупка),CGN-202208310005-N1,< Синьцзян лимитед >,
"Синьцзян-Уйгурский автономный район и Тэгу, округ Лоуп",Проект Контрольный пункт 2 на базе Синьцзян-Синьцзян-цзян и в рамках проекта Тэоп 1 млн. кВт (запрос предложений),CGN-20230703007,,
"провинция Цинхай, тибетский автономный район Хайси-Монголия, муниципалитет Деринха","500 МВт ветроэнергетического проекта 500 МВт в новом энергетическом озере Цинхайо в рамках проекта, платформа для подвески и три сегмента фундаментальной инженерии ветротехники (торги)",CGN-20230316007,Чайна-Хеллоу,
"провинция Джилин, Белый город, Гранд-Ан","Проект 2-1 (Ветряная электроэнергия 260 МВт) Дорога, платформа, ветряная база и коробка)",CGN-202301110004,Белая энергетика,
Фуцзянь,Проект BZ проект LOT134Ba Заполненный насос (номер тендера: CGN-20230110004),CGN-20230110004,Чайна Инжиниринг лимитед,
"Гуанси-Маньчжурский автономный округ, Хочжоу, Чжуншань","Проект по закупке новых энергоносителей в Гуанси-Синьцзян-Унь, проект по закупке твердых конструкций на дорогах на станциях Пение и гор, (пункт 2) (запрос предложений)",CGN-20230628005,Чайно-Ядерные часы,
"Гуанси-Шань, Стохэ, Пинъюн","100 МВт проект EPC по 100 МВт новой энергии в рамках проекта (запрос No: CGN-20230324001), утвержденный проект, финансируемый за счет собственных средств предприятия и реализованный",CGN-20230324001,Компания Cloud,
,,,,
"префектура Гуйчжоу, автономный округ Минамбуйи, муниципалитет","80 МВт, 50 МВт ветряной дороги, повесную платформу, инфраструктуру ветряных машин (прием)",CGN-202306140011,Центро Гуанчжоу,
Тяньцзинь,"ветроэнергетический проект Тяньцзинен 35 МВт, башня проекта Сухопутный ветер, нового источника энергии 40 МВт",CGN-202305310001,Тяньцзиньнинг лтд.,
Гуандун,"Проект Сухой проект 5, блок 6 LOT101La (сжиженный и жидкий переключатель неядерного класса)",CGN-202304230004-N1,,
"Пекин, Тойота",8-й сегмент 2023-го проекта по новым источникам энергии,CGN-20230524009,Дун Стэйт Компани,
"префектура Сычуань, муниципалитет Чжоучжоу, префектура Гуань","Проект строительства лифтовой станции 110 кВ, 35 кВ и установка коробок (проект конкурса)",CGN-20230518004,Хунчэн,
,,,,
Гуанси,Проект BT LOT150Bb DEL Холодный гидравл (переторг),CGN-202210120002-N1,Чайна Хинон инжиниринг лтд.,
Шаньдун,Проект SK LOT134Ab Водный насос в экстренном порядке,CGN-20221010004,Чайна Хинэ,
"провинция Цзянси, муниципалитет Чжоу, округ Ричуань",150 МВт сельскохозяйственного (лесного) фотоэлектрического проекта EPC,CGN-202307060013,Наньчан,
Гуандун,Проект LF LOT130Af ASP охлаждающий конденсатор и частичное переключение,CGN-20230428001,,
"провинция Джилин, Белый город, муниципалитет",первая совместная закупка оборудования для замены коробок (пункт 2: Килинский региональный ящик) (номер тендера: CGN-202301050010),CGN-202301050010,Ветро,
провинция Шаньдун,интегрированное устройство для охлаждения проб между пробами проекта SK LOT130N REN,CGN-202305110003,,
Чжэцзян,"Проект CS проекта 3, 4-й энергоблок LOT120F охлаждающий насос для реактора",CGN-20221019001,Чайна Инжиниринг лимитед,
"Синьцзян-Уйгурский автономный округ, Баян-Монгольский автономный округ, Жуан",основное оборудование для проекта «Синьцзян» (ветроэнергетика),CGN-20230704003,Новая энергетическая компания,
"Янцзы, провинция Гуандун",Проект строительства новой резервной линии водоснабжения для кольцевой сети Яньцзян с высоким атомным водоемом до 5/6,CGN-202303150013,,
"префектура Аньхой, муниципалитет Тяньаньмэнь","Закупка основного оборудования для крепления в городе Гуаняня в рамках проекта (закупка тендера No CGN-202301050012) была одобрена, проект",CGN-202301050012,Хинэ Энго Лтд.,
"Шэньчжэнь, провинция Гуандун",Проект в рамках базы данных RPV для мониторинга облучения и его исследования по ключевым вопросам (номер тендера: CGN-202210120005),CGN-202210120005,Чайна атомная энергетика,
провинция Шаньдун,Проект SK LOT134Gb Неядерный центробежный насос,CGN-202303310005,,
"Синьцзян-Уйгурский автономный округ, Баян-Монгольский автономный округ, Жуан",Трехъядерный сегмент проекта (номер тендера: CGN-20230706008),CGN-20230706008,China New Energy Trucks Ltd.,
"Синьцзян-Уйгурский автономный округ, Баян-Монгольский автономный округ, Жуан",Закупка компенсационного оборудования на базе Синьцзян в 2023 году (пункт 1: Станция 1 ветроэнергетического проекта),CGN-202307060016,Таймэнь таймс лимитед,
"префектура Сычуань, муниципалитет Гуаньюань, округ Шин","электрическая дорога, подвесная платформа, фундаментальная инженерия ветряной машины",CGN-202304240017,Чайна,
провинция Гуандун,Проект по оценке безопасности гор на Японской атомной электростанции (запрос No CGN-202304130007),CGN-202304130007,компания Jiangian,Объявление тендера на проект по оценке безопасности гор на Японской атомной электростанции (запрос No CGN-202304130007)
"Шэньчжэнь, провинция Гуандун","Закупка экспериментального оборудования для высокотемпературной свинцово-свинцовой среды в рамках проекта (номер тендера: CGN-202305100014) одобрена, проект",CGN-202305100014,Чайна Хинан,
"Гуандун, Янцзян",Проект Основы проектно-конструкторских работ на Японском атомном электростанционном заводе (номер тендера: CGN-202210240006),CGN-202210240006,Янцзян энтерпрайз лимитед,Объявление тендера на рамочный контракт на проектирование строительных работ на Японской электростанции
Гуандун,Ремонтно-ремонтные работы на АЭС &lt; &lt; Тайпин &gt; &gt;,CGN-20221109003,Чайна инжиниринг лтд.,Объявление тендеров на корректировочные работы на АЭС &lt; &lt; Тайпин &gt; &gt;
Гуандун,Большой резерв материалов LOT140Cm для нержавеющей стали малой калибровой трубы,CGN-20230529001,Чайна инжиниринг лтд.,
Шэньчжэнь,Закупка 2-го тендера на использование экспериментальных измерительных приборов для теплообработки проекта (номер тендера: CGN-202301120001-N1),CGN-202301120001-N1,China Institute of Nuclear,
"Чунцин, Чунцин, Чжэцзян",Закупка оборудования для ветрогенератора ветроэнергии ветряной электростанции в Чжэцзян-цзяне,CGN-20230109003,China and China New Energy Jong Kong Ltd.,
"Синьцзян-Уйгурский автономный округ, Та-Сити, округ Минь",,CGN-20230607004,China (Пекин) New Energy Technology Ltd.,Открытие торгов
"Хубэй, Хуанган, округ Чун",Закупка технических услуг измерительного центра проекта по гидроэнергетике,CGN-20230110001,,
Пекин,Закупка шкафов безопасности и внутренних приложений для системы DCS-контроля на АЭС-проекта,CGN-202304100012,Хинли инжиниринг,
"Юньнань, муниципалитет Цюй, Цзюй",проект экологизации и восстановления окружающей среды,CGN-20230630003,Энергия ветра,Объявление тендера на проект экологизации и восстановления окружающей среды в рамках проекта Hong Konga New Energy (запрос No CGN-CGN) 
,,,,
Чжэцзян,БОП (второй контрактный пакет),CGN-202301130001,,
,Проект по модернизации 3MX и 9PX (третий повторный тендер),202201280003-N3,Фуцзяньнинд,
"префектура Гуйчжоу, автономный округ Минамбуйи, муниципалитет","Новый энергетический штат в рамках этого проекта состоит из 50 МВт, 80 МВт на суше, 50 МВт на суше и 50 МВт",CGN-20230710001,,
"Автономный округ Нинсяя, Синьчуань, Пинхуа",Проект водородного автономного водорода мощностью 1 млн. кВт на основе водорода на основе водорода на основе водорода на основе водорода на основе водорода на основе водорода,CGN-202304240003,,
Центральный Японский башня,Запасы 75 000 кВт/300 000 кВт-часовой резерв в Центральном Японском башне,CGN-202212080011,,
"провинция Юньнань, город Таити, Уаньин",линия поставляет тендер на строительство,CGN-202209280013,Чайконин,
Гуанси-Шань,,CGN-20221103002,Чайна Инжиниринг лимитед,
провинция Цзянсу; муниципалитет Су; округ Гусу,Закупка высоковольтных ионосферных установок системы мониторинга радиационной среды на АЭС Тайпин,CGN-202306020009,Радиационный мониторинг,
"префектура Юньнань, чусуньский автономный округ, префектура Осаки",Проект по приобретению башни 2 в рамках проекта Энергоно-энергетика,CGN-20221220001,,
"префектура Юньнань, чусуньский автономный округ, префектура Осаки",Проект по приобретению башни 2 в рамках проекта Энергоно-энергетика,CGN-20221220001,,
Гуандун,,CGN-202304030004-N1,< Чайна Инжиниринг лимитед >,
"провинция Цинхай, тибетский автономный район Хайси-Монголия, муниципалитет Деринха","Проект 500 МВт ветроэлектроэнергия в районе озера Цинхайо (по пункту 1 тендера) (номер тендера: CGN-20230320008, утвержденный на утверждение проекта, финансируемый за счет собственных средств предприятия и реализованный, торгуемый на тендере на поставку в Китай &lt; &lt; Холодные озера &gt; &gt; . В рамках этого проекта уже имеются условия для проведения торгов и в настоящее время проводятся открытые торги.",,,
Хэйлунцзян,Пять новых источников энергии в провинции Хэйлунцзян и 200 МВт инженерные работы в области наземного ветроэнергетики,CGN-202303280006-N1,,
страна,Долгосрочное соглашение о сотрудничестве по теме предварительной оценки безопасности на рабочем месте (2023),CGN-20230406008,,
провинция Шаньдун,Проект SK LOT41A (Оборудование для нагрева воды) ,CGN-202304060012,,
"Шэньчжэнь, провинция Гуандун",Проект по разработке технологий интеллектуального регулирования поведения персонала на атомных электростанциях в рамках проекта (запрос No CGN-20230526003) уже реализован,,Чайна энтерпрайз,
,,,,
"провинция Гуйчжоу, муниципалитет Анхен, округ Хунглингбуйи","50 МВт ветряная дорога в Гуанцзяне, Новая энергетика в рамках проекта, платформа для подвески, фундаментальная инженерия ветряных машин (сценарный проект)",CGN-202306140013,Hong Kong Guangzhou Song Energy Ltd.,
"Хубэй, Хуанган, округ Чун",Проект по заказу на строительство электроэнергетической электростанции Ван Вэй,CGN-20230414002,,
"префектура Юньнань, чусуньский автономный округ, префектура Осаки","Проект строительства 110 кВ ветряной станции, 35 кВ и проект установки коробок",CGN 202212270002,,
"Хубэй, Хуанган, округ Чун",Объявление конкурса на проектирование (запросы предложений),CGN-20221215001,China New Energy Corp.,
"Автономный район Гуанси-Маньчжур, муниципалитет Чжунцзян, южный порт",110 кВ ветровой электростанции Саут-Мук в Порт-Кусигуйском порту,CGN-20221028001,Сент-Энтерпрайз,
"Хубэй, Хуанган, округ Чун","Проект Хубэй , торгуя гидроэнергетическим заводом и строительством на склоне завода (запрос No: CGN-202304190006), утвержденный проектом, финансируемый за счет собственных средств предприятия и реализованный, торгующий за счет новых технологий",CGN-202304190006,Инк. . В рамках этого проекта уже имеются условия для проведения торгов и в настоящее время проводятся открытые торги.,
"Чунцин, Чунцин, округ",Вторая совместная закупка кабелей (пункт 2: Региональный кабель в Чунцине) (номер тендера: CGN-202303140016),CGN-202303140016,Конг Лтд.,
Гуандун; город Уичжоу; округ Уидон,Проект по закупке электрического оборудования в АТЦПТ (третий тендер) (номер тендера: CGN-202204240004-N2),CGN-202204240004-N2,,
"Чжэцзян, Вэньчжоу",Услуги по фундаментальному тестированию (перезагрузка) в рамках проекта Чжэцзян,CGN-202301170011-N1,,
"Шэньчжэнь, провинция Гуандун",Закупка оборудования для системы высоковольтного технологического процесса в рамках проекта (номер тендера: CGN-202304270011),CGN-202304270011,China Institute of Nuclear,
Гуандун; город Уичжоу; округ Уидон,Проект по централизованному закупке оборудования для лабораторных приборов в рамках проекта (запрос No CGN-20220819001-N1),,,
Гуанси,Проект BT LOT130Ra фильтрации для замены оборудования для перевалки (номер тендера: CGN-20221107004),CGN-20221107004,Чайна инжиниринг лтд.,
"Чунцин, Чунцин, округ","50 МВт наземный ветровой турбины, коробки и автомобильной инфраструктуры (перезакупка)",CGN-20230309002-N1,< &lt; Чжунцин &gt; &gt;,
"провинция Цзянсу, муниципалитет Саутонг",первая совместная закупка оборудования связи,CGN-20230605002,Energy Ltd.,
,,,,
"провинция Джилин, Белый город, Гранд-Ан",2-1 (100 МВт фотоэлектрической тепловой связи) проекта EPC,CGN-20230605007,Дань,
"Юньнань, муниципалитет Цюй, Цзюй",480 МВт ветряная ферма (Западный А район),CGN-202209280011,Чайна Хинан,
"провинция Хэйлунцзян, Цзиньцзян, округ Цинго",кабельное оборудование,CGN-CGN,Гон Лтд.,
Гуандун,,CGN-202306070010,Чайна Хинси,
"Автономный район Гуанси-Маньчжур, муниципалитет Чжунцзян, южный порт","Закупка оборудования для башни 2-го башня в порту Гуанси, Хинси, Гуандун (заказ No CGN-2)",CGN-20230519002,Ветроэнергетическая компания,
"префектура Сычуань, муниципалитет Гуаньюань, округ Шин",Закупка 1-го подъемного терминала и строительного оборудования для монтажа электропроводов в рамках проекта по строительству 100 МВт наземной ветровой электростанции Сычуань,CGN-20230602004,Синьцзян,Объявление тендерного проекта по строительству 100 МВт наземной ветровой электростанции Сычуань
"Пекин, Тойота",В рамках этого проекта в 2023-2024 годах будет производиться сбор фотоэлектрических компонентов (6 тендерных заявок),,,
Гуандун,Закупка динамической системы многократной загрузки (третий тендер),CGN-202305230007-N2,,
"Хэйлунцзян, муниципалитет Хэйэя, 5 крупных городов","200 МВт ветряная дорожка, платформа, ветряная база и коробка",CGN-20230504006,,Объявление тендера
Гуандун,,CGN-20230213001,Чайна Инжиниринг лимитед,
,,,,
"Синьцзян-Уйгурский автономный округ, Та-Сити, округ Торри",75 MW300 MWh для хранения энергии в башне проекта с 300 МВт ветряной установкой (пункт 2),CGN 202212120002,Новая энергетическая компания,
"провинция Цинхай, тибетский автономный район Хайси-Монголия, муниципалитет Деринха","Проект &lt; &lt; Интегрированная фотоэлектрическая зона &gt; &gt; в рамках проекта &lt; &lt; Хиннед &gt; &gt; (пункт 2) &lt; &lt; Электронный контракт &gt; &gt; (номер тендера: CGN 20221107002, одобренный подразделением по утверждению проектов, финансируется за счет средств, полученных от предприятий и реализованных, а тендеры - за счет широкого диапазона ядерных технологий",CGN 20221107002,,
"провинция Цюси, муниципалитет Цяо, округ",330kV-компонента проекта Сянган и Инжиниринг,CGN-202302020004,Инжиниринг,
"префектура Аньхой, муниципалитет Тяньаньмэнь",Закупка оборудования для ветрогенераторных установок ветроэнергетической фермы,CGN-20221008003,Си-эн-Энго лимитед,
"Синьцзян-Уйгурский автономный округ, Баян-Монгольский автономный округ, Жуан",Проект уведомления и съемки (номер тендера: CGN-202306210003),CGN-202306210003,China New Energy Trucks Ltd.,
,,,,
"провинция Цинхай, тибетский автономный район Хайси-Монголия, муниципалитет Деринха",Интегрированная система хранения фотоэлектрической энергии,CGN-20221226005,Дилингха лтд.,
